{
  "id": "jarvis-canvas-architecture-20261020",
  "title": "AI 产出协作规范",
  "project": "SignalCraft",
  "producer": "GPT",
  "type": "report",
  "summary": "原件存入 Google Drive，代码与卡片索引交由 GitHub 维护。各 AI 按统一格式提交更新。",
  "createdAt": "2026-10-20T09:04:11.499Z",
  "status": "ready",
  "demoContent": false,
  "archiveConfirmed": true,
  "drive": {
    "fileId": "1xFIhcD6N6sQ4hjXsWtdWoOmSRJSN0SZ-",
    "webViewLink": "https://drive.google.com/file/d/1xFIhcD6N6sQ4hjXsWtdWoOmSRJSN0SZ-/view?usp=drivesdk",
    "mimeType": "text/markdown",
    "archivedAt": "2026-10-20T09:04:11.499Z"
  },
  "metrics": [
    {
      "label": "展示端",
      "value": "PWA"
    },
    {
      "label": "原件归档",
      "value": "Drive"
    }
  ]
}
