{
  "id": "demo-hardware-opportunities",
  "title": "智能硬件机会库 · 示例",
  "project": "智能硬件",
  "producer": "GPT",
  "type": "table",
  "summary": "统一展示竞品、用户问题和待验证假设。以下均为界面演示数据。",
  "createdAt": "2026-10-20T08:00:00+08:00",
  "status": "demo",
  "demoContent": true,
  "archiveConfirmed": false,
  "sourceLabel": "示例数据 · 尚未归档真实原件",
  "metrics": [
    {"label": "示例方向", "value": "3 个"},
    {"label": "核验状态", "value": "待验证"}
  ],
  "items": [
    {"title": "水墨屏环境检测仪", "detail": "示例问题：用户根据哪一项环境指标采取行动？"},
    {"title": "AI 运动辅助产品", "detail": "示例问题：识别和反馈能否改善真实训练体验？"},
    {"title": "智能家居联动", "detail": "示例问题：可靠性、安装与售后的主要成本是什么？"}
  ],
  "drive": null
}
